{
  "schemaVersion": 2,
  "id": "I-0001",
  "createdAt": "2000-01-01T00:00:00Z",
  "updatedAt": "2000-01-01T00:00:00Z",
  "revision": 1,
  "createdBy": "curator",
  "updatedBy": "curator",
  "digest": "sha256:0000000000000000000000000000000000000000000000000000000000000000",
  "correlationId": "intake-submit",
  "campaignId": "C-CAMPAIGN",
  "sourceRuns": [
    {
      "path": "active/campaign-slug/runs/R-20000101-0001/report.md",
      "sha256": "sha256:0000000000000000000000000000000000000000000000000000000000000000"
    }
  ],
  "candidateFindingIds": ["F-0001"],
  "coverage": [
    {
      "sourceHandle": "path:active/campaign-slug/runs/R-20000101-0001/report.md#L1-L1",
      "sourcePath": "active/campaign-slug/runs/R-20000101-0001/report.md",
      "sourceSha256": "sha256:0000000000000000000000000000000000000000000000000000000000000000",
      "startLine": 1,
      "endLine": 1,
      "sourceLineCount": 1,
      "disposition": "candidate-finding",
      "targetId": "F-0001"
    }
  ],
  "uncertainties": [],
  "requestedDecisions": [],
  "triage": {"F-0001": "routine"},
  "status": "submitted"
}
